{
  "ir_version": "1.0.0",
  "dialect": "enginegen.implicit.fidget.v1",
  "units": {"length": "m"},
  "metadata": {
    "domain_bbox": [[-0.2, -0.2, -0.2], [0.2, 0.2, 0.2]]
  },
  "ops": [
    {
      "id": "s",
      "op": "fidget.prim.sphere",
      "args": {"center": [0, 0, 0], "radius": 0.1}
    },
    {
      "id": "b",
      "op": "fidget.prim.box",
      "args": {"lower": [-0.12, -0.12, -0.03], "upper": [0.12, 0.12, 0.03]}
    },
    {"id": "u", "op": "fidget.csg.union", "inputs": ["s", "b"]}
  ],
  "outputs": {"main": "u"}
}
